{
  "schema_version": "v1",
  "pair_id": "pair-aabbccdd",
  "intent": "extract-helper",
  "before": "def f(x):\n    return x + 1\n",
  "after": "def helper(x):\n    return x + 1\n\ndef f(x):\n    return helper(x)\n",
  "annotators": ["a", "b"],
  "ratings_per_annotator": {
    "a": { "semantic": 5, "stylistic": 4, "intent": 5 },
    "b": { "semantic": 4, "stylistic": 5, "intent": 5 }
  },
  "kappa_final": 0.78
}
